deal_id,customer_name,customer_type,product,deal_size_lakhs,stage,probability_pct,rm_name,branch,days_in_stage,next_action,competitor_threat,expected_close_date,blockers,cross_sell_identified
D001,Pinnacle Auto Components,Corporate,Commercial Vehicle Loan (12 vehicles),180,Proposal Submitted,60,Rakesh Joshi,Pune Hinjewadi,8,Follow up on fleet pricing approval,SBI fleet rate 8.75%,2026-05-20,Waiting for fleet pricing sanction from RBH,Corporate CC + Business Loan
D002,Rahul Mehta,Individual,Home Loan,85,Document Collection,75,Priya Sharma,Bangalore JP Nagar,5,Collect salary slips and property docs,SBI pre-approved 8.25%,2026-05-15,Customer hesitant on rate difference vs SBI,Credit Card + CASA
D003,Dr Sneha Kapoor,Individual,LAP,60,Legal Verification,65,Amit Deshmukh,Mumbai Andheri,12,Legal report pending from advocate,ICICI LAP at 9.25%,2026-05-25,Property legal opinion delayed; advocate unresponsive,Business Loan + POS
D004,FreshKart Retail (re-approach),Corporate,Merchant Acquiring + Business Loan,8,Initial Meeting,30,Manoj Bhagat,Chennai Anna Nagar,3,Schedule product demo with finance head,Paytm (existing),2026-06-15,Lost previously to Paytm; re-approaching with bundled offer,Current Account
D005,Bharat Logistics Solutions,Corporate,CV Loan (20 trucks) + Corporate CC,350,Credit Assessment,70,Deepak Patil,Mumbai Lower Parel,10,Submit to credit committee with fleet proposal,SBI + Tata Motors Finance,2026-05-30,Large exposure needs committee approval; competitive pricing needed,Business Loan (working capital)
D006,Neha & Vikram Patel,Individual,Home Loan,120,Rate Negotiation,50,Snehal Patil,Pune Hinjewadi,7,Get rate approval from BM for Kotak match,Kotak 8.45% + nil processing,2026-05-18,Kotak very aggressive; couple is rate-sensitive,Credit Card + Auto Loan (future)
D007,Vishal Mega Mart Franchise,Corporate,POS + Personal Loan + CC,6,Documentation,80,Ankit Gupta,Lucknow Gomti Nagar,4,Collect KYC and business registration,None,2026-05-10,Straightforward case; just documentation pending,Current Account
D008,Mohammed Irfan,Individual/Business,Business Loan + CV (3 tempo),25,Field Investigation,55,Chirag Shah,Surat Ring Road,15,FI report pending; trade references needed,Axis Business Loan 12.5%,2026-06-01,Self-employed income assessment in progress; FI delayed,LAP (future) + CC
D009,SolarTech Energy Solutions,Corporate,Business Loan + CV (8 vehicles),220,Meeting Scheduled,40,Harsh Patel,Ahmedabad SG Highway,2,Present customized proposal to CFO,Yes Bank + Tata Capital,2026-06-20,First meeting; need to understand full requirement,Payment Gateway + CC
D010,Deepa & Arun Nair,Individual,Home Loan + Auto Loan,168,Site Visit Done,65,Vinod Menon,Kochi MG Road,6,Submit joint application with dual income,Federal Bank 8.3%,2026-05-28,Federal Bank offering relationship pricing as existing customer,Life Insurance + CASA
D011,Nexus Technologies,Corporate,Corporate Credit Cards (5200 cards),1800 (annual T&E),RFP Evaluation,55,Neha Kapoor,Mumbai BKC,14,Submit total value proposition vs Axis rebate,Axis Bank 1.2% rebate + SBI in race,2026-06-15,Axis incumbent with higher rebate. Need to win on analytics + SAP integration + fleet card bundling,Purchase Cards + Fleet Cards + Salary Accounts
D012,QuickKart India,Corporate,Payment Gateway + Nodal Account + Seller Lending,800 (GMV),Technical Evaluation,50,Vikram Nair,Bangalore Koramangala,10,Provide sandbox access for CTO team testing,Razorpay (API quality) + Cashfree (settlement),2026-06-30,CTO evaluating API quality. CFO evaluating cost. Need to win both stakeholders,BBPS + Seller Lending revenue share
D013,Anand Malhotra (HNI),Individual,Loan Against Securities (OD ₹4 Cr) + Education Loan (₹60L),460,Rate Comparison,60,Sanjay Mehta,Mumbai Worli,8,Present LTV and rate advantage vs ICICI Private Banking,ICICI Private Banking 9.5%/50% LTV,2026-05-25,HNI comparing HDFC vs ICICI LAS terms. Key: higher LTV (65% vs 50%) and better rate (8.75% vs 9.5%),Wealth Advisory + Infinia CC + NRI Services
D014,Vikram Industries Group,Corporate,Salary Accounts (12K) + FD (₹200 Cr) + Prepaid Cards,200 (FD book),Annual Banking Review,45,Deepak Joshi,Delhi Connaught Place,20,Present migration plan to Group CFO and HR Head,SBI (incumbent) + ICICI (secondary),2026-06-30,Two stakeholders: CFO wants FD returns; HR fears migration disruption. Need dual strategy,DPPS Prepaid + Treasury Products
D015,Patel Infrastructure,Corporate,CV Loans (30) + Equipment Finance (5) + LAP,4500,Proposal Building,55,Rajendra Kulkarni,Ahmedabad SG Highway,7,Structure milestone-linked EMI proposal for NHAI payment cycle,L&T Finance (equipment) + Union Bank (WC),2026-06-10,Needs EMI flexibility aligned to 120-day NHAI payment cycle. Standard EMI won't work,Fuel Cards (150 vehicles) + Business Loan
D016,Max Life (ABCP Partnership),Corporate,Distribution Partnership (5000 branches),8000 (annual premium),Partnership Negotiation,50,Sanjay Bhatt,Mumbai BKC,15,Present quality vs volume math and salary base value,ICICI Bank (50K leads/quarter guarantee),2026-06-20,ICICI offers guaranteed volume. Our strength: higher conversion quality + salary base access,Co-branded Products + Digital Shelf
D017,Reliance Retail,Corporate,Salary Accounts (25K) + FD (₹500 Cr),500 (FD book),Competitive Presentation,40,Meera Iyer,Mumbai Navi Mumbai,5,Present salary tier benefits + WhatsApp banking demo + FD yield comparison,SBI (60% incumbent) + Kotak (failing),2026-07-15,Kotak service failure opened door. SBI is strong incumbent. Need premium features to differentiate,Zero-balance Contractual + Salary Advance + DPPS
D018,Finova Pay (DBC),Corporate,BankOne API + Co-branded Cards + Lending API,400 (monthly UPI),Strategic Discussion,35,Karan Mathur,Bangalore HSR Layout,3,Schedule sandbox demo and present contractual protections,Small bank (ended relationship),2026-07-30,Scarred by previous partner. Need to prove stability and contractual protection before technical evaluation,FD-in-App + UPI PSP
D019,PowerGrid Solutions (DPPS),Corporate,Corporate Prepaid Cards + Salary + FD,4000 (quarterly prepaid),Product Demo,50,Deepak Joshi,Delhi NCR,8,Demo unified treasury dashboard with prepaid controls,SBI (banking) + Sodexo (prepaid),2026-06-15,Consolidating from Sodexo (prepaid) + SBI (banking) to single platform. Key: spend controls + API integration,Salary Accounts + Corporate FD
D020,TCS Pune Zone,Corporate,Personal Loans (salary-linked bulk),2000 (annual PL volume),Corporate Tie-up Pitch,60,Anita Verma,Pune Hinjewadi,4,Present pre-approved salary deduction PL program vs Bajaj,Bajaj Finance 12.5% instant approval,2026-05-20,500 PL apps/year through Bajaj. Our advantage: 10.5-11% rate saves ₹42K per employee. Challenge: match speed,Credit Cards + Salary Migration
