Circular_No,Issuer,Date,Subject,Impact_Area,Key_Changes,Compliance_Deadline,Implementation_Status,Owner,Remarks
RBI/2024-25/89,RBI,2024-12-15,Revised LTV norms for housing loans,Credit Policy,LTV cap for loans above 75L reduced from 80% to 75%. EWS/LIG LTV maintained at 90%.,2025-03-31,Partially Implemented,Credit Policy Head,System changes done. Policy manual update pending.
NHB/2024/45,NHB,2024-11-20,Updated refinance guidelines for HFCs,Finance / Treasury,New refinance eligibility criteria. Individual loan cap for refinance raised to 35L.,2025-01-31,Implemented,Treasury Head,Refinance claims filed under new norms.
RBI/2024-25/72,RBI,2024-10-01,Digital lending guidelines — KYC updates,Operations / IT,Video KYC allowed for loans up to 50L. eKYC mandatory for all digital originations.,2025-02-28,In Progress,IT + Operations,Video KYC pilot live in 5 branches. Full rollout planned.
RBI/2024-25/95,RBI,2025-01-05,Risk weight changes for housing loans,Credit Risk / Finance,Risk weight for housing loans LTV 75-80% increased from 35% to 50%.,2025-04-01,Impact Assessment,Risk Management,Capital adequacy impact being calculated. Board paper prepared.
SEBI/2024/198,SEBI,2024-09-15,Customer communication post merger,Compliance / Legal,All customer-facing documents must carry updated entity name and merger disclaimer.,2024-12-31,Partially Implemented,Legal + Marketing,Templates updated. Legacy documents being phased out.
IRDAI/2024/78,IRDAI,2024-08-01,Mandatory home loan insurance disclosure,Product / Sales,Insurance premium and coverage details must be disclosed at sanction stage. Cannot be bundled.,2025-01-01,Implemented,Product Head,Sanction letter template updated with insurance disclosure section.
